{
  "$schema": "https://pastelsalt.github.io/himawari-c/spec/theme/1.0.json",
  "colors": {
    "accent": "#f5b700",
    "textbox": "#2a1e10",
    "nameplate": "#3a2a14",
    "choice": "#3a2a14",
    "choice_hover": "#6b4a1a",
    "panel": "#3a2a14",
    "background": "#120c04"
  },
  "textbox": {
    "opacity": 86,
    "height": 27
  },
  "transition": {
    "ms": 450
  },
  "strings": {
    "en": {
      "start": "Begin the summer",
      "the_end": "See you next summer"
    },
    "ja": {
      "start": "夏をはじめる",
      "the_end": "また来年の夏に"
    },
    "es": {
      "start": "Empezar el verano",
      "load": "Cargar",
      "save": "Guardar",
      "language": "Idioma",
      "quit": "Salir",
      "resume": "Volver al juego",
      "back": "Atrás",
      "title": "Pantalla de título",
      "history": "Historial",
      "auto": "Auto",
      "skip": "Saltar",
      "menu": "Menú",
      "rollback": "Rebobinar",
      "text_speed": "Velocidad del texto",
      "empty_slot": "Vacío",
      "slot": "Ranura %d",
      "quick_slot": "Guardado rápido",
      "saved": "Guardado.",
      "loaded": "Cargado.",
      "load_remapped": "Esta partida se guardó con una versión anterior de la historia. Sigue desde la misma línea.",
      "load_fallback": "La línea de esta partida cambió, así que la historia sigue un poco antes.",
      "load_failed": "No se puede cargar esta partida: %s",
      "no_quick_save": "Todavía no hay guardado rápido.",
      "the_end": "Hasta el próximo verano",
      "error_title": "La historia se detuvo por un error",
      "error_release": "Algo salió mal en esta parte de la historia. Tu progreso hasta el último guardado está a salvo.",
      "click_to_continue": "Haz clic para volver a la pantalla de título",
      "confirm_quit": "¿Salir del juego?",
      "yes": "Sí",
      "no": "No",
      "history_empty": "Todavía no se ha dicho nada.",
      "reloaded": "Historia recargada.",
      "reload_failed": "Error al recargar: %s",
      "config": "Opciones",
      "extras": "Extras",
      "gallery": "Galería",
      "music_room": "Sala de música",
      "locked": "Aún no visto",
      "auto_speed": "Velocidad auto",
      "text_size": "Tamaño del texto",
      "line_spacing": "Interlineado",
      "font": "Fuente",
      "font_default": "La del juego",
      "font_readable": "Fácil de leer",
      "textbox_opacity": "Opacidad del cuadro de texto",
      "high_contrast": "Alto contraste",
      "reduce_motion": "Reducir movimiento y destellos",
      "skip_unread": "Saltar texto no leído",
      "fullscreen": "Pantalla completa",
      "volume_music": "Volumen de la música",
      "volume_ambient": "Volumen del ambiente",
      "volume_sfx": "Volumen de efectos",
      "volume_voice": "Volumen de las voces",
      "controls": "Controles",
      "keyboard": "Teclado",
      "gamepad": "Mando",
      "press_key": "Pulsa una tecla o un botón del mando (Esc cancela)",
      "reset_controls": "Restablecer controles",
      "accessibility": "Accesibilidad",
      "a11y_prompt": "Antes de empezar",
      "a11y_prompt_body": "Ajusta el juego para que te resulte cómodo. Puedes cambiarlo cuando quieras en Opciones.",
      "continue": "Continuar",
      "on": "Sí",
      "off": "No",
      "default": "Predeterminado",
      "replay_voice": "Reproducir voz",
      "now_playing": "Sonando",
      "stop": "Detener",
      "action_advance": "Siguiente / aceptar",
      "action_back": "Menú / atrás",
      "action_up": "Arriba",
      "action_down": "Abajo",
      "action_left": "Izquierda",
      "action_right": "Derecha",
      "action_rollback": "Rebobinar",
      "action_skip": "Saltar",
      "action_auto": "Auto",
      "action_history": "Historial",
      "action_hide": "Ocultar el cuadro de texto",
      "action_quick_save": "Guardado rápido",
      "action_quick_load": "Carga rápida"
    }
  }
}
